id,name,screen_name,created_at,retweet_count,favorite_count,text
819950408743452672,b'Washington Pes\xc3\xa1ntez',pesanteztwof,2017-01-13 16:53:06,1,1,b'..y PROMESA: Fundaci\xc3\xb3n Industria Farmac\xc3\xa9utica de investigaci\xc3\xb3n e Innovaci\xc3\xb3n'
819950159689879552,b'Washington Pes\xc3\xa1ntez',pesanteztwof,2017-01-13 16:52:06,1,1,b'En este momento mantenemos un  di\xc3\xa1logo con IFI: Industria Farmac\xc3\xa9utica de Investigaci\xc3\xb3n e Innovaci\xc3\xb3n..'
819947919214280704,b'Washington Pes\xc3\xa1ntez',pesanteztwof,2017-01-13 16:43:12,2,1,b'https://t.co/VmTi36S1nW'
819947827749154816,b'Washington Pes\xc3\xa1ntez',pesanteztwof,2017-01-13 16:42:50,1,1,b'En este momento el Dr. Pes\xc3\xa1ntez mantiene una reuni\xc3\xb3n con representantes del sector farmac\xc3\xa9utico'
819937043979661312,b'Washington Pes\xc3\xa1ntez',pesanteztwof,2017-01-13 15:59:59,1,2,b'Tengo el agrado de presentarles mi agenda para hoy #Viernes 13 de enero. Los espero! #JustoLoQueNecesitamos\xe2\x80\xa6 https://t.co/6LOHPXfjxa'
819910081563230208,b'Washington Pes\xc3\xa1ntez',pesanteztwof,2017-01-13 14:12:51,2,4,"b'El pa\xc3\xads ya vivi\xc3\xb3 el neoliberalismo y sabemos que no queremos volver. Mi posici\xc3\xb3n no va hacia los extremos, es de centro! @radiopublicaEC'"
819909453139021824,b'Washington Pes\xc3\xa1ntez',pesanteztwof,2017-01-13 14:10:21,3,7,b'Nac\xc3\xad en #Alaus\xc3\xad y para m\xc3\xad es un premio el caldo de gallina y las papas con cuy. Soy nacionalista!! \xf0\x9f\x87\xaa\xf0\x9f\x87\xa8\xe2\x80\xa6 https://t.co/CDd374zUUa'
820405465188368384,b'Washington Pes\xc3\xa1ntez',pesanteztwof,2017-01-14 23:01:19,0,0,b'Lucharemos cada d\xc3\xada por construir un mejor pa\xc3\xads #El 19Vota19  #TreceraV\xc3\xada #JustoLoQueNecesitamoos\xe2\x80\xa6 https://t.co/G2HXO5EJeV'
820345115533332482,b'Washington Pes\xc3\xa1ntez',pesanteztwof,2017-01-14 19:01:31,0,0,"b'Tengo el agrado de compartirles el v\xc3\xaddeo de mi visita a #ElOro, gracias por todo el respaldo y confianza, el 19 de\xe2\x80\xa6 https://t.co/v4MnTskIQr'"
820292658086019073,b'Washington Pes\xc3\xa1ntez',pesanteztwof,2017-01-14 15:33:04,1,1,"b'""No tenemos miedo de ir contra los corruptos"" #Pes\xc3\xa1ntezPresidente #TerceraV\xc3\xada #Uni\xc3\xb3nEcuatoriana #El19Vota19 https://t.co/92MVEhkapM'"
820288655218638849,b'Washington Pes\xc3\xa1ntez',pesanteztwof,2017-01-14 15:17:10,3,3,b'Me ha conmovido la historia de una mujer d Colta que tiene hijos y ning\xc3\xban apoyo.Vamos a trabajar por los campesinos\xe2\x80\xa6 https://t.co/eUczEiRVms'
820270022614511616,b'Washington Pes\xc3\xa1ntez',pesanteztwof,2017-01-14 14:03:07,3,3,"b'Tengo el agrado de presentarles mi agenda para el d\xc3\xada de hoy #S\xc3\xa1bado 14 de enero, donde visitar\xc3\xa9 Santo Domingo de L\xe2\x80\xa6 https://t.co/anM3RxvUZb'"
820767777019621376,b'Washington Pes\xc3\xa1ntez',pesanteztwof,2017-01-15 23:01:01,2,0,b'Nuestro compromiso es entregarnos por completo al pueblo ecuatoriano #El 19Vota19 #TerceraV\xc3\xada #Pes\xc3\xa1ntezPresidente\xe2\x80\xa6 https://t.co/CHulVJNvor'
820682543854977024,b'Washington Pes\xc3\xa1ntez',pesanteztwof,2017-01-15 17:22:20,1,3,b'Acabamos de dar el discurso en Fundeporte. Maravillosa gente en el sur de Quito. Llena de esperanza. https://t.co/HAQlGLK3JB'
820681851308281856,b'Washington Pes\xc3\xa1ntez',pesanteztwof,2017-01-15 17:19:35,0,2,b'https://t.co/bT1MA6ufjn'
820680104699367425,b'Washington Pes\xc3\xa1ntez',pesanteztwof,2017-01-15 17:12:39,0,4,b'https://t.co/p5sISXrHQz'
820679894975791105,b'Washington Pes\xc3\xa1ntez',pesanteztwof,2017-01-15 17:11:49,0,3,"b'En este momento el Dr Pes\xc3\xa1ntez da un discurso en FUNDEPORTE, sur de Quito'"
820631941351440384,b'Washington Pes\xc3\xa1ntez',pesanteztwof,2017-01-15 14:01:16,0,0,b'Trabajaremos para garantizar tu seguridad y toda libertad. #El 19Vota19 #TerceraV\xc3\xada #Pes\xc3\xa1ntezPresidente\xe2\x80\xa6 https://t.co/Ql8fwk0R8X'
820517416581087233,b'Washington Pes\xc3\xa1ntez',pesanteztwof,2017-01-15 06:26:11,2,0,"b'Tengo el agrado de presentarles mi agenda para el d\xc3\xada de hoy #Domingo 15 de enero, los espero!\xe2\x80\xa6 https://t.co/1eF47Mt1cR'"
820465473154404352,b'Washington Pes\xc3\xa1ntez',pesanteztwof,2017-01-15 02:59:46,1,3,b'Gracias #SantoDomingo por su calidez y afecto. Con #Uni\xc3\xb3nEcuatoriana saldremos adelante . Vamos @a_alcivar por el v\xe2\x80\xa6 https://t.co/VUAqiewVQa'
821136055344709632,b'Washington Pes\xc3\xa1ntez',pesanteztwof,2017-01-16 23:24:26,1,2,b'En este momento grabamos una entrevista con Karina Crespo en Cuenca programa Encuentros. Especial sobre presidencia\xe2\x80\xa6 https://t.co/VsdS9zRp75'
821133082933784577,b'Washington Pes\xc3\xa1ntez',pesanteztwof,2017-01-16 23:12:37,2,2,b'En @SolTelevision2 junto con los candidatos de #Uni\xc3\xb3nEcuatoriana ! Gracias por acompa\xc3\xb1arme en esta jornada por\xe2\x80\xa6 https://t.co/eUIGHCCrij'
821127449463422976,b'Washington Pes\xc3\xa1ntez',pesanteztwof,2017-01-16 22:50:14,1,3,b'En #Gualaceo saboreamos las delicias de su #gastronom\xc3\xada Creemos en el potencial que tiene #Ecuador para el #turismo\xe2\x80\xa6 https://t.co/3uV5rKrBxX'
821101709795663873,b'Washington Pes\xc3\xa1ntez',pesanteztwof,2017-01-16 21:07:57,4,3,b'Gracias por el c\xc3\xa1lido recibimiento en el mercado de #Gualaceo ! Sonr\xc3\xado y agradezco su cari\xc3\xb1o. Vamos por la\xe2\x80\xa6 https://t.co/mgJKHFLibE'
821100841826447360,b'Washington Pes\xc3\xa1ntez',pesanteztwof,2017-01-16 21:04:30,2,1,"b'En #Gualaceo nos referimos al concurso de frecuencias de radio, el gobierno deber\xc3\xada suspenderlo y retomarlo despu\xc3\xa9s\xe2\x80\xa6 https://t.co/FUJQKvYXnG'"
821077205828718596,b'Washington Pes\xc3\xa1ntez',pesanteztwof,2017-01-16 19:30:35,3,4,"b'Tengo el agrado de presentarles mi agenda para el d\xc3\xada de ma\xc3\xb1ana #Martes 17 de enero, donde visitar\xc3\xa9 #Latacunga desd\xe2\x80\xa6 https://t.co/G8PJku3TnC'"
821074143160528897,b'Washington Pes\xc3\xa1ntez',pesanteztwof,2017-01-16 19:18:25,1,1,b'El domingo recorrimos el sur de Quito: https://t.co/bTHA5ssyiq v\xc3\xada @YouTube'
821053290888753152,b'Washington Pes\xc3\xa1ntez',pesanteztwof,2017-01-16 17:55:33,1,2,b'#Ecuador tenemos esperanza de que el 19 de #febrero todo va a cambiar para revalorizar tu esfuerzo diario. #Cuenca\xe2\x80\xa6 https://t.co/aoItZjbuEM'
821031001698824192,b'Washington Pes\xc3\xa1ntez',pesanteztwof,2017-01-16 16:26:59,2,1,"b'Renata Paredes, del Museo del Sombrero, nos gu\xc3\xada en este gran atractivo tur\xc3\xadstico que revaloriza nuestro patrimonio\xe2\x80\xa6 https://t.co/PtbcIwpcpJ'"
821026511687995392,b'Washington Pes\xc3\xa1ntez',pesanteztwof,2017-01-16 16:09:08,1,1,"b'Con do\xc3\xb1a Ruth Nivelo, en el mercado 9 de octubre, conversamos de sus necesidades mientras nos servimos un #morocho\xe2\x80\xa6 https://t.co/nVY48Uv4jL'"
821026239720935425,b'Washington Pes\xc3\xa1ntez',pesanteztwof,2017-01-16 16:08:04,0,1,"b'La justicia debe ser independiente.No hay exoneraciones para la corrupci\xc3\xb3n.Como hice antes, ap\xc3\xb3yar\xc3\xa9 la fiscalizaci\xc3\xb3n imparcial e implacable.'"
821025488172937217,b'Washington Pes\xc3\xa1ntez',pesanteztwof,2017-01-16 16:05:04,1,1,"b'\xc2\xa1Hay que reactivar el sector productivo! Una vez al mes, 3 d\xc3\xadas de un fin de semana no se cobrar\xc3\xa1 IVA a productos nacionales.'"
821024015171076097,b'Washington Pes\xc3\xa1ntez',pesanteztwof,2017-01-16 15:59:13,1,0,"b'\xc2\xa1El Ecuador primero para los ecuatorianos! Terminar con el desempleo, dando prioridad a los compatriotas q necesitan trabajar es imperativo.'"
821023682684420097,b'Washington Pes\xc3\xa1ntez',pesanteztwof,2017-01-16 15:57:54,0,1,b'Tengo el agrado de compartirles mi visita a El Oro: https://t.co/rlvY566D70 v\xc3\xada @YouTube'
821023282812121094,b'Washington Pes\xc3\xa1ntez',pesanteztwof,2017-01-16 15:56:19,1,2,b'Traeremos extensiones d las mejores universidades del mundo para q los ecuatorianos podamos estudiar lo que queramos y con la mejor calidad.'
821022900513861632,b'Washington Pes\xc3\xa1ntez',pesanteztwof,2017-01-16 15:54:48,1,1,b'No m\xc3\xa1s ni\xc3\xb1os desamparados por sus padres. Las pensiones alimenticias ser\xc3\xa1n asumidas por el Estado y tambi\xc3\xa9n cobradas a los irresponsables.'
821005046544551937,b'Washington Pes\xc3\xa1ntez',pesanteztwof,2017-01-16 14:43:51,7,8,"b'En rueda de prensa en #Cuenca para  hacer anuncios importantes de lo que ser\xc3\xa1 mi gobierno: menos impuestos, pagar p\xe2\x80\xa6 https://t.co/Gc4O93GVT5'"
820994331037339648,b'Washington Pes\xc3\xa1ntez',pesanteztwof,2017-01-16 14:01:16,9,16,b'Gracias pueblo ecuatoriano por todo el apoyo recibido en cada rinc\xc3\xb3n del pa\xc3\xads #El19Vota19 #JustoLoQueNecesitamos\xe2\x80\xa6 https://t.co/qqk5up2hOI'
820988169277599744,b'Washington Pes\xc3\xa1ntez',pesanteztwof,2017-01-16 13:36:47,1,3,b'1 vez cada mes x 3 d\xc3\xadas propongo q los ecuatorianos No paguen Iva en productos nacionales. @tomebamba'
820987429352050691,b'Washington Pes\xc3\xa1ntez',pesanteztwof,2017-01-16 13:33:51,1,4,b'Es obligaci\xc3\xb3n del Estado cuidar de los ni\xc3\xb1os. Por eso pagaremos las pensiones alimenticias de ni\xc3\xb1os y adolescentes @tomebamba'
820986511944536064,b'Washington Pes\xc3\xa1ntez',pesanteztwof,2017-01-16 13:30:12,2,1,b'Ley de extinci\xc3\xb3n de dominio presentada hace 8 a\xc3\xb1os no fue aprobada x asamble\xc3\xacstas de Alianza Pa\xc3\xads @tomebamba'
820985722417139712,b'Washington Pes\xc3\xa1ntez',pesanteztwof,2017-01-16 13:27:04,3,2,b'En un pa\xc3\xads democr\xc3\xa1tico el Fiscal no deber\xc3\xada esperar informes para iniciar acciones en contra de casos de corrupci\xc3\xb3n.'
820984998400499714,b'Washington Pes\xc3\xa1ntez',pesanteztwof,2017-01-16 13:24:11,1,0,"b'Caso Palo Azul termin\xc3\xb3 en el archivo, obviamente con el aplauso de Petrobras. Pero este caso no prescribe y se re abrir\xc3\xa1 el caso.'"
820983662338568192,b'Washington Pes\xc3\xa1ntez',pesanteztwof,2017-01-16 13:18:52,2,0,b'Cuenca puede dar testimonio del trabajo realizado como Fiscal en esta ciudad.'
820982353606676481,b'Washington Pes\xc3\xa1ntez',pesanteztwof,2017-01-16 13:13:40,5,9,b'Listos para atender la invitaci\xc3\xb3n de una radio emblem\xc3\xa1tica del pa\xc3\xads @tomebamba en Cuenca https://t.co/9VvwgA4NMp'
820973259139190784,b'Washington Pes\xc3\xa1ntez',pesanteztwof,2017-01-16 12:37:32,4,5,"b'Inicio la jornada en la bella Cuenca, en los micr\xc3\xb3fonos de @RadioCiudad1017 para hablar de #Uni\xc3\xb3nEcuatoriana y su p\xe2\x80\xa6 https://t.co/PsXNrmpssL'"
820957682437881856,b'Washington Pes\xc3\xa1ntez',pesanteztwof,2017-01-16 11:35:38,2,0,b'Buenos d\xc3\xadas a todos los ecuatorianos desde Cuenca. Que esta semana sea llena de bendiciones y \xc3\xa9xitos.'
820854995390267392,b'Washington Pes\xc3\xa1ntez',pesanteztwof,2017-01-16 04:47:36,0,0,"b'Tengo el agrado de presentarles mi agenda para el d\xc3\xada de ma\xc3\xb1ana #Lunes 16 de enero, donde visitar\xc3\xa9 #Cuenca, los esp\xe2\x80\xa6 https://t.co/ojxOJHjvMk'"
820854628644507648,b'Washington Pes\xc3\xa1ntez',pesanteztwof,2017-01-16 04:46:08,3,4,"b'Me reun\xc3\xad con representantes de IFI (Industria Farmac\xc3\xa9utica de Investigaci\xc3\xb3n e innovaci\xc3\xb3n, y en la tarde recorrimos\xe2\x80\xa6 https://t.co/FRwkBQ4Eyf'"
