id,name,screen_name,created_at,retweet_count,favorite_count,text
816747939582328837,b'Washington Pes\xc3\xa1ntez',pesanteztwof,2017-01-04 20:47:37,0,3,b'Tengo el agrado de visitar la hermosa provincia del #Carchi el d\xc3\xada de ma\xc3\xb1ana #Jueves 05 desde las 13:00 los espero!\xe2\x80\xa6 https://t.co/rS4LWqurJN'
816695616596217856,b'Washington Pes\xc3\xa1ntez',pesanteztwof,2017-01-04 17:19:43,2,5,"b'Un gusto conversar con @Yasunidos y conocer sus preocupaciones, muchas de estas tambi\xc3\xa9n son nuestras! Gracias por e\xe2\x80\xa6 https://t.co/edDLbxDOWm'"
816690766928084992,b'Washington Pes\xc3\xa1ntez',pesanteztwof,2017-01-04 17:00:26,0,0,b'Hay que endurecer las leyes para proteger a los animales. Sancionar el maltrato animal es urgente.#yasunidos'
816690378401267712,b'Washington Pes\xc3\xa1ntez',pesanteztwof,2017-01-04 16:58:54,0,2,b'El respeto a los animales debe implicar el sacrificio racional del ganado. La muerte violenta en este caso tambi\xc3\xa9n debe evitarse. #yasunidos'
816689728959512576,b'Washington Pes\xc3\xa1ntez',pesanteztwof,2017-01-04 16:56:19,1,3,b'\xc2\xa1Necesitamos determinar claramente donde est\xc3\xa1n nuestros santuarios ecol\xc3\xb3gicos  y hacer respetar esos territorios!'
816688795810721796,b'Washington Pes\xc3\xa1ntez',pesanteztwof,2017-01-04 16:52:36,0,1,b'Cabe el indulto a las personas que est\xc3\xa1n siendo objeto de sanciones por haber expresado sus preocupaciones  ambientales. #yasuni'
816686047358750720,b'Washington Pes\xc3\xa1ntez',pesanteztwof,2017-01-04 16:41:41,4,6,b'Sobre la consulta respecto a la explotaci\xc3\xb3n del Yasun\xc3\xad https://t.co/eW7X9ePwJ9'
816685701211258881,b'Washington Pes\xc3\xa1ntez',pesanteztwof,2017-01-04 16:40:19,3,5,b'Proponemos una auditor\xc3\xada ambiental para asegurarnos de que se est\xc3\xa1 extrayendo con los estudios de impacto adecuado.Defenderemos el ambiente!'
816684672117862400,b'Washington Pes\xc3\xa1ntez',pesanteztwof,2017-01-04 16:36:13,6,6,"b'No soy partidario de la miner\xc3\xada a gran escala. La extracci\xc3\xb3n debe ser racional, evitando el impacto ambiental. A cielo abierto es imposible.'"
816674514226544641,b'Washington Pes\xc3\xa1ntez',pesanteztwof,2017-01-04 15:55:51,5,7,b'Fundamental el di\xc3\xa1logo con @yasunidos ! Estamos atentos a las  inquietudes de este colectivo. Buena iniciativa. https://t.co/dmf4uhfzGP'
816667697886953472,b'Washington Pes\xc3\xa1ntez',pesanteztwof,2017-01-04 15:28:46,3,4,"b'Tenemos que volver a la restauraci\xc3\xb3n ambiental y la mirada al campo, a los bosques a las reservas naturales.'"
816667204511039490,b'Washington Pes\xc3\xa1ntez',pesanteztwof,2017-01-04 15:26:49,7,8,b'Comenzamos nuestra intervenci\xc3\xb3n con @Yasunidos sobre nuestra propuesta de gobierno en temas ambientales. Un di\xc3\xa1logo\xe2\x80\xa6 https://t.co/rW4ASlUtvy'
816666758727745536,b'Washington Pes\xc3\xa1ntez',pesanteztwof,2017-01-04 15:25:02,9,10,b'Acomp\xc3\xa1\xc3\xb1enme en parte de este di\xc3\xa1logo con Yasunidos. La sustentabilidad ambiental es prioritaria. #yasunidos  https://t.co/kAsBn0WnAC'
816533998818168832,b'Washington Pes\xc3\xa1ntez',pesanteztwof,2017-01-04 06:37:30,2,5,"b'Los invito hoy Mi\xc3\xa9rcoles 04 de Enero, a escuchar mi entrevista en \xc3\x81gora Democr\xc3\xa1tica, iniciaremos desde las 12:15, l\xe2\x80\xa6 https://t.co/4rprY4FCON'"
817136461430525953,b'Washington Pes\xc3\xa1ntez',pesanteztwof,2017-01-05 22:31:28,0,0,b'@AcuerdoCancerEc siempre abiertos al di\xc3\xa1logo! la salud ser\xc3\xa1 una prioridad en nuestro gobierno. Hablemos de este tema sensible: #c\xc3\xa1ncer.'
817123202812047361,b'Washington Pes\xc3\xa1ntez',pesanteztwof,2017-01-05 21:38:47,4,3,"b'Participamos de debate en #Tulc\xc3\xa1n para contarles de nuestra propuesta, en di\xc3\xa1logo democr\xc3\xa1tico !#Elecciones2017\xe2\x80\xa6 https://t.co/Ifs9Qj34Nm'"
817121296559575040,b'Washington Pes\xc3\xa1ntez',pesanteztwof,2017-01-05 21:31:13,1,0,"b'Estamos en #Tulc\xc3\xa1n para recorrer esa provincia del norte, comerciante y agr\xc3\xadcola por excelencia!! Saludos fraternos.'"
817040565288271873,b'Washington Pes\xc3\xa1ntez',pesanteztwof,2017-01-05 16:10:25,8,6,"b'No somos los de ahora ni los de antes, somos #JustoLoQueNecesitamos, sacaremos al pa\xc3\xads adelante, Washington Pes\xc3\xa1nte\xe2\x80\xa6 https://t.co/F4wfuTErq1'"
817037792144478208,b'Washington Pes\xc3\xa1ntez',pesanteztwof,2017-01-05 15:59:24,5,5,b'Hoy quiero enviarles un saludo cordial a todos los periodistas en su d\xc3\xada. Gracias por su gran labor. Un abrazo a to\xe2\x80\xa6 https://t.co/BlSvKyy6ho'
817008163555774464,b'Washington Pes\xc3\xa1ntez',pesanteztwof,2017-01-05 14:01:40,1,1,"b'Volveremos la mirada al campo para fomentar la vocaci\xc3\xb3n del pa\xc3\xads: la agricultura, por ello hemos elegido un experto manabita @a_alcivar'"
817004543972089857,b'Washington Pes\xc3\xa1ntez',pesanteztwof,2017-01-05 13:47:17,1,0,"b'Ecuador debe desmontar este sistema impositivo perverso, m\xc3\xa1s de 27 impuestos en los \xc3\xbaltimos a\xc3\xb1os @radioquitoec'"
817003340055855104,b'Washington Pes\xc3\xa1ntez',pesanteztwof,2017-01-05 13:42:30,3,0,b'Cada ecuatoriano ya tiene una deuda de 2700$ Somos el pa\xc3\xads con mayor deuda percapita de la regi\xc3\xb3n. @radioquitoec'
817000905941938176,b'Washington Pes\xc3\xa1ntez',pesanteztwof,2017-01-05 13:32:49,3,0,b'No podemos tener un tribunal de la inquisici\xc3\xb3n que persigue a periodistas y comunicadores! Ley de #Comunicaci\xc3\xb3n a derogarse @radioquitoec'
817000093639475200,b'Washington Pes\xc3\xa1ntez',pesanteztwof,2017-01-05 13:29:36,4,1,b'La ley de comunicaci\xc3\xb3n ser\xc3\xa1 derogada porque ha buscado perseguir y controlar toda libertad de expresi\xc3\xb3n.\xe2\x80\xa6 https://t.co/F41MoiJOoj'
816999000104640512,b'Washington Pes\xc3\xa1ntez',pesanteztwof,2017-01-05 13:25:15,3,1,"b'Vivimos un presidencialismo exacerbado que controla los poderes del Estado, la \xc3\xbanica forma de cambiar es con la Constituci\xc3\xb3n. @radioquitoec'"
816997962249216000,b'Washington Pes\xc3\xa1ntez',pesanteztwof,2017-01-05 13:21:07,3,3,b'La constituci\xc3\xb3n necesita cambios de fondo no s\xc3\xb3lo cambios cosm\xc3\xa9ticos.En mi gobierno convocaremos a una asamblea constituyente @radioquitoec'
816992292556996609,b'Washington Pes\xc3\xa1ntez',pesanteztwof,2017-01-05 12:58:36,0,0,"b'En pocos minutos, atenderemos entrevista en @radioquitoec 760AM y 90.9FM sobre nuestra propuesta de #gobierno #EleccionesEc2017 !'"
816988271884562432,b'Washington Pes\xc3\xa1ntez',pesanteztwof,2017-01-05 12:42:37,1,3,"b'Gracias @ecuavisaopinion y @estefaniespin por el espacio para presentar mi propuesta. A las \xc3\xb3rdenes, siempre!'"
816987433027899392,b'Washington Pes\xc3\xa1ntez',pesanteztwof,2017-01-05 12:39:17,2,2,"b'El 19 de febrero, los ecuatorianos tienen dos opciones: los antes y los de ahora o una tercera: gente nueva @UnionEc @ecuavisaopinion'"
816985146591211520,b'Washington Pes\xc3\xa1ntez',pesanteztwof,2017-01-05 12:30:12,2,1,"b'Sobre el banco central hay q ue darle personalidad e independencia, debe estar en la capacidad de gestionar  la econom\xc3\xada @ecuavisaopinion'"
816984484201590784,b'Washington Pes\xc3\xa1ntez',pesanteztwof,2017-01-05 12:27:34,1,2,b'La seguridad social debe estar controlada por los afiliados. \xc3\x89l gobierno debe sacar las manos del #IESS @ecuavisaopinion'
816982095847424000,b'Washington Pes\xc3\xa1ntez',pesanteztwof,2017-01-05 12:18:05,1,2,b'Buen d\xc3\xada! Estamos en @ecuavisaopinion en Contacto Directo hablando sobre nuestra propuesta de #gobierno #EleccionesEc2017'
816882488433868800,b'Washington Pes\xc3\xa1ntez',pesanteztwof,2017-01-05 05:42:16,1,1,"b'Washington Pes\xc3\xa1ntez es justo lo que necesitamos! El 19 de febrero, vota todo listas 19! Por el futuro Presidente de\xe2\x80\xa6 https://t.co/DAm5QoIB12'"
816802330297454592,b'Washington Pes\xc3\xa1ntez',pesanteztwof,2017-01-05 00:23:45,7,7,"b'Tengo el agrado de invitarlos a observar mis entrevistas el d\xc3\xada de ma\xc3\xb1ana, donde iniciar\xc3\xa9 en Contacto Directo desde\xe2\x80\xa6 https://t.co/z6gPJwtFOD'"
817507152436793345,b'Washington Pes\xc3\xa1ntez',pesanteztwof,2017-01-06 23:04:28,5,5,b'\xc2\xbfConoces a Washington Pesantez? Es #JustoLoQueNecesitamos #PesantezPresidente https://t.co/WwozgQd493'
817408787141324806,b'Washington Pes\xc3\xa1ntez',pesanteztwof,2017-01-06 16:33:36,4,4,b'Ahora recorremos el mercado Amazonas en #Ibarra y nos encontramos con nuestra gente que busca a quien los represent\xe2\x80\xa6 https://t.co/wxC29jc6is'
817367881809821697,b'Washington Pes\xc3\xa1ntez',pesanteztwof,2017-01-06 13:51:03,0,2,b'Vamos a volver la mirada al campo y apoyar la vocaci\xc3\xb3n natural del pa\xc3\xads: #agricultura con cr\xc3\xa9ditos reales y capacitaci\xc3\xb3n @radioloslagosfm'
817367342061617158,b'Washington Pes\xc3\xa1ntez',pesanteztwof,2017-01-06 13:48:54,3,6,b'La partidocracia ya tuvo su tiempo y Alianza Pa\xc3\xads tambi\xc3\xa9n.Estoy convencido d la urgente necesidad d cambio y altern\xe2\x80\xa6 https://t.co/kXAqFt5BGj'
817365059513024513,b'Washington Pes\xc3\xa1ntez',pesanteztwof,2017-01-06 13:39:50,5,6,"b'En #Ibarra atendemos a radio y diario del Norte, hablamos de la educaci\xc3\xb3n y la necesidad de que \xc3\xa9sta vuelva al camp\xe2\x80\xa6 https://t.co/wc4jQMUMbs'"
817360481967022080,b'Washington Pes\xc3\xa1ntez',pesanteztwof,2017-01-06 13:21:39,1,5,"b'Somos la nueva opci\xc3\xb3n, gente nueva que no representa ni a la partidocracia ni a los AP. Somos #Uni\xc3\xb3nEcuatoriana #JustoLoQueNecesitamos'"
817359919489961984,b'Washington Pes\xc3\xa1ntez',pesanteztwof,2017-01-06 13:19:25,5,7,"b'Iniciamos el d\xc3\xada en #Ibarra en entrevista con el TVN canal, lo vamos a decir siempre: No somos ni los de ahora ni l\xe2\x80\xa6 https://t.co/uPMcjRLxmf'"
817207642980515842,b'Washington Pes\xc3\xa1ntez',pesanteztwof,2017-01-06 03:14:19,1,3,"b'Tengo el agrado de invitarlos el d\xc3\xada de ma\xc3\xb1ana Viernes 06 de enero, a escuchar mis entrevistas en radio, iniciando\xe2\x80\xa6 https://t.co/Ak5OjcZ9Ie'"
817170524623278080,b'Washington Pes\xc3\xa1ntez',pesanteztwof,2017-01-06 00:46:50,3,5,"b'El d\xc3\xada de ma\xc3\xb1ana, Viernes 06 de enero, tengo el agrado de visitar la hermosa provincia de Imbabura, iniciando desde\xe2\x80\xa6 https://t.co/AteRG3VcKC'"
817879929979277317,b'Washington Pes\xc3\xa1ntez',pesanteztwof,2017-01-07 23:45:45,8,4,"b'Tarde andina para recorrer en caravana las calles de #Riobamba Cu\xc3\xa1nto apoyo hemos recibido,con hechos los retribuir\xe2\x80\xa6 https://t.co/UrGeNCpKzI'"
817819283728306176,b'Washington Pes\xc3\xa1ntez',pesanteztwof,2017-01-07 19:44:46,6,7,b'En la @PrensaRiobamba hablando de la propuesta de gobierno de #Uni\xc3\xb3nEcuatoriana Con hechos y argumentos m\xc3\xa1s q prome\xe2\x80\xa6 https://t.co/rMPxiD9qn0'
817814985728475136,b'Washington Pes\xc3\xa1ntez',pesanteztwof,2017-01-07 19:27:41,7,6,b'Gracias por la calidez con la que gente de #Riobamba nos ha recibido en este d\xc3\xada.Juntos para renovar #Ecuador :ni l\xe2\x80\xa6 https://t.co/Xc9P1hPiYP'
817810755324149760,b'Washington Pes\xc3\xa1ntez',pesanteztwof,2017-01-07 19:10:52,1,4,b'\xe2\x80\x9cWashington Pes\xc3\xa1ntez tiene claro los problemas de nuestra educaci\xc3\xb3n\xe2\x80\x9d\n#Pes\xc3\xa1ntezPresidente #Uni\xc3\xb3nEcuatoriana\xe2\x80\xa6 https://t.co/843NDFpu7K'
817790838549999616,b'Washington Pes\xc3\xa1ntez',pesanteztwof,2017-01-07 17:51:44,8,8,b'En estos momentos en Radio Tricolor 97.7 FM de Riobamba #JustoLoQueNecesitamos https://t.co/qDiZakk5S1'
817774000432705536,b'Washington Pes\xc3\xa1ntez',pesanteztwof,2017-01-07 16:44:49,4,5,b'Ahora conversamos con los miembros de la Asociaci\xc3\xb3n Avicultores de #Cotal\xc3\xb3 y su presidente David Rosero. Volveremos\xe2\x80\xa6 https://t.co/237SciIHKB'
817728028335804418,b'Washington Pes\xc3\xa1ntez',pesanteztwof,2017-01-07 13:42:09,12,7,b'Buen d\xc3\xada! Volvimos a mi provincia: #Chimborazo Ahora caminamos hacia la feria el rastro en #Riobamba Estoy contento\xe2\x80\xa6 https://t.co/Dn7omTp276'
817521541655183360,b'Washington Pes\xc3\xa1ntez',pesanteztwof,2017-01-07 00:01:39,7,8,b'Somos los \xc3\xbanicos que contamos con una propuesta de estabilidad econ\xc3\xb3mica real. #JustoLoQueNecesitamos https://t.co/4IF8a11bkK'
818216920315035649,b'Washington Pes\xc3\xa1ntez',pesanteztwof,2017-01-08 22:04:50,9,7,"b'Gracias #Alaus\xc3\xad y #Riobamba por el cari\xc3\xb1o a mi persona. #Chimborazo tiene en m\xc3\xad, un hijo luchador que propone\xe2\x80\xa6 https://t.co/rwvRZUrNxJ'"
817907383095689216,b'Washington Pes\xc3\xa1ntez',pesanteztwof,2017-01-08 01:34:50,5,8,b'Tengo el agrado de compartirles mi visita y recorrido a la hermosa provincia de Imbabura. #JustoLoQueNecesitamos https://t.co/6rJBL8x1Jy'
817905058176204801,b'Washington Pes\xc3\xa1ntez',pesanteztwof,2017-01-08 01:25:36,7,9,b'En la concentraci\xc3\xb3n en el barrio la Dolorosa de #Riobamba sumamos apoyo de nuestra propuesta que busca la\xe2\x80\xa6 https://t.co/t1ZxuRa3Pe'
818489954531704834,b'Washington Pes\xc3\xa1ntez',pesanteztwof,2017-01-09 16:09:46,0,2,b'Miremos juntos hacia un mejor futuro. #Pes\xc3\xa1ntezPresidente #JustoLoQueNecesitamos #Uni\xc3\xb3nEcuatoriana #Listas19 https://t.co/KpoApo8phl'
818473919745294336,b'Washington Pes\xc3\xa1ntez',pesanteztwof,2017-01-09 15:06:03,1,2,"b'Hay q recuperar los bienes mal habidos deber\xc3\xadan ser recuperados por el #Estado, eso propone la ley de extinci\xc3\xb3n de dominio que ya propuse.'"
818473685367529473,b'Washington Pes\xc3\xa1ntez',pesanteztwof,2017-01-09 15:05:07,1,3,"b'La corrupcion nos conmueve, se lleva los fondos destinados para atender a la gente. Vamos a combatirla, vamos a limpiar el pa\xc3\xads.'"
818471608545329153,b'Washington Pes\xc3\xa1ntez',pesanteztwof,2017-01-09 14:56:52,1,3,b'Es vergonzoso que la mitad de cantones rurales del pa\xc3\xads NO tenga alcantarillado.Vamos a garantizar la calidad de la vida rural @democraciaec'
818470751321866240,b'Washington Pes\xc3\xa1ntez',pesanteztwof,2017-01-09 14:53:28,0,2,"b'La migraci\xc3\xb3n a las grandes ciudades se da por el abandono al campo, uno de los factores es la falta de viabilidad @democraciaec'"
818470191537553408,b'Washington Pes\xc3\xa1ntez',pesanteztwof,2017-01-09 14:51:14,2,3,"b'No lo le\xc3\xad en Huasipungo, yo viv\xc3\xad la realidad del campo, yo conozco sus necesidades por eso hay q apoyar al agro!! @democraciaec'"
818469961979011073,b'Washington Pes\xc3\xa1ntez',pesanteztwof,2017-01-09 14:50:20,0,2,"b'Los #emprendedores deben ser apoyados con asistencia t\xc3\xa9cnica y cr\xc3\xa9ditos, hay q fortalecer su participaci\xc3\xb3n en la econom\xc3\xada @democraciaec'"
818466677323087873,b'Washington Pes\xc3\xa1ntez',pesanteztwof,2017-01-09 14:37:16,4,4,"b'Dos millones de ecuatorianos subsisten con un d\xc3\xb3lar diario, necesitamos darles trabajo y los emprendimientos puedes\xe2\x80\xa6 https://t.co/NOIxH11Ik5'"
818465863116398593,b'Washington Pes\xc3\xa1ntez',pesanteztwof,2017-01-09 14:34:02,1,1,"b'En #Ecuador hay 85000 empresas familiares, tenemos que fortalecerle y nunca m\xc3\xa1s estigmatizarla @democraciaec'"
818464673922252801,b'Washington Pes\xc3\xa1ntez',pesanteztwof,2017-01-09 14:29:19,2,3,b'En @democraciaec iniciamos di\xc3\xa1logo con Gonzalo Rosero. Les invito a escucharme en 92.5 FM. https://t.co/BIkg0TyLx3'
818443197043142659,b'Washington Pes\xc3\xa1ntez',pesanteztwof,2017-01-09 13:03:58,5,3,b'Yo denunci\xc3\xa9 casos de #corrupci\xc3\xb3n! como presidente propondr\xc3\xa9 la ley de extinci\xc3\xb3n de dominio para recuperar bienes mal habidos @notihoyecuador'
818441400262033408,b'Washington Pes\xc3\xa1ntez',pesanteztwof,2017-01-09 12:56:50,1,3,"b'No creemos en las encuestas, el campesinados no ha sido encuestado. @notihoyecuador https://t.co/eLHnLCBWV2'"
818440681484066816,b'Washington Pes\xc3\xa1ntez',pesanteztwof,2017-01-09 12:53:59,1,2,"b'En @notihoyecuador hablamos sobre la importancia del #debate, estaremos en cada espacio que nos inviten a compartir\xe2\x80\xa6 https://t.co/VV3RTryg0D'"
818435611577225216,b'Washington Pes\xc3\xa1ntez',pesanteztwof,2017-01-09 12:33:50,1,2,b'En nuestra propuesta la #educaci\xc3\xb3n ser\xc3\xa1 una prioridad! @RADIOAMERICAEC https://t.co/biv25rs1a7'
818432540256124934,b'Washington Pes\xc3\xa1ntez',pesanteztwof,2017-01-09 12:21:37,4,4,b'En @RADIOAMERICAEC propondremos la regulaci\xc3\xb3n de la tributaci\xc3\xb3n. Es fundamental revisar las leyes tributarias y lab\xe2\x80\xa6 https://t.co/AcOOkvpPw9'
818307564861538304,b'Washington Pes\xc3\xa1ntez',pesanteztwof,2017-01-09 04:05:01,6,7,"b'Iniciamos la semana, cont\xc3\xa1ndoles a ustedes m\xc3\xa1s de nuestra propuesta en varios medios de comunicaci\xc3\xb3n. S\xc3\xadgannos... https://t.co/UbMgbRrCs5'"
818967549048135681,b'Washington Pes\xc3\xa1ntez',pesanteztwof,2017-01-10 23:47:34,3,2,"b'Porque nuestro pa\xc3\xads s\xc3\xad tiene futuro, te invitamos a participar de la #Uni\xc3\xb3nEcuatoriana #JustoLoQueBuscamos\xe2\x80\xa6 https://t.co/MAVnNeN13V'"
818856538727129088,b'Washington Pes\xc3\xa1ntez',pesanteztwof,2017-01-10 16:26:27,0,0,"b'Tengo el agrado de presentarles mi entrevista en radio Informativa democracia, donde pude exponer mis... https://t.co/ArfyU3eHER'"
818820180432273408,b'Washington Pes\xc3\xa1ntez',pesanteztwof,2017-01-10 14:01:58,2,2,"b'""Ra\xc3\xbal Vayas representa a los campesinos del Ecuador por m\xc3\xa1s de 20 a\xc3\xb1os"" #VayasAsamble\xc3\xadstaNacional #Listas19\xe2\x80\xa6 https://t.co/mYU08lPyl6'"
818814516314210304,b'Washington Pes\xc3\xa1ntez',pesanteztwof,2017-01-10 13:39:28,0,0,b'@cartografo1 gracias por ese voto analizado y consciente!!'
818807689547550721,b'Washington Pes\xc3\xa1ntez',pesanteztwof,2017-01-10 13:12:20,0,1,b'El 19 de febrero vamos a las urnas tenemos la obligaci\xc3\xb3n de elegir lejos del continuismo y de partidos tradicionales #El19vota19 @RadioVigia'
818804958372003840,b'Washington Pes\xc3\xa1ntez',pesanteztwof,2017-01-10 13:01:29,1,3,"b'El pa\xc3\xads est\xc3\xa1 cansado de la polarizaci\xc3\xb3n social, alentanda por este gobierno! Hay una gran preocupaci\xc3\xb3n sobre casos de corrupci\xc3\xb3n @RadioVigia'"
818803696880455680,b'Washington Pes\xc3\xa1ntez',pesanteztwof,2017-01-10 12:56:28,0,3,"b'Creemos en la alternabilidad, no con los partidos tradicionales ni con el partido que gobierna el pa\xc3\xads hace 10 a\xc3\xb1os!!! @RadioVigia'"
818803095572516864,b'Washington Pes\xc3\xa1ntez',pesanteztwof,2017-01-10 12:54:05,1,5,"b'Mi af\xc3\xa1n de servicio al pa\xc3\xads es la motivaci\xc3\xb3n que me lleva a ser candidato presidencial, tenemos una propuesta distinta!!. @RadioVigia'"
818802343932268544,b'Washington Pes\xc3\xa1ntez',pesanteztwof,2017-01-10 12:51:06,2,5,b'Despu\xc3\xa9s de una breve entrevista en @Gamanoticiasec visitamos a @RadioVigia para compartir nuestras propuestas. Pued\xe2\x80\xa6 https://t.co/ynABv0x60V'
818665124177346560,b'Washington Pes\xc3\xa1ntez',pesanteztwof,2017-01-10 03:45:50,3,5,"b'Tengo el agrado de presentarles mi agenda de entrevistas para el d\xc3\xada de ma\xc3\xb1ana #Martes 10 de enero, donde iniciar\xc3\xa9\xe2\x80\xa6 https://t.co/dZnMFES0yy'"
818655879381872640,b'Washington Pes\xc3\xa1ntez',pesanteztwof,2017-01-10 03:09:06,1,4,"b'\xe2\x80\x9cWashington Pes\xc3\xa1ntez conoce la realidad de nuestros pueblos, por eso sabe lo que realmente necesita el Ecuador\xe2\x80\x9d\xe2\x80\xa6 https://t.co/k2VsNR8G9H'"
818634698498904065,b'Washington Pes\xc3\xa1ntez',pesanteztwof,2017-01-10 01:44:56,1,4,b'Mi pa\xc3\xads S\xc3\xad tiene futuro!! https://t.co/UHSVpHJEXC'
819300551317979136,b'Washington Pes\xc3\xa1ntez',pesanteztwof,2017-01-11 21:50:47,2,2,b'Les promet\xc3\xad que en mi gobierno invertiremos en su futuro que es el futuro de la Patria! https://t.co/YSEonYjU5M'
819230520550846464,b'Washington Pes\xc3\xa1ntez',pesanteztwof,2017-01-11 17:12:31,3,12,"b'Regresaremos a los ciudadanos lo que les pertenece, nunca m\xc3\xa1s tendr\xc3\xa1n el poder peque\xc3\xb1os grupos que solo se mueven p\xe2\x80\xa6 https://t.co/mplzaTQolo'"
819204242070192129,b'Washington Pes\xc3\xa1ntez',pesanteztwof,2017-01-11 15:28:06,6,23,b'\xe2\x80\x9cWashington Pes\xc3\xa1ntez no tiene miedo de ir tras la delincuencia y la corrupci\xc3\xb3n\xe2\x80\x9d Nicol\xc3\xa1s Azanza \xe2\x80\x93 Escuch\xc3\xb3 propuestas\xe2\x80\xa6 https://t.co/0Yn6Jn4eow'
819156493232652290,b'Washington Pes\xc3\xa1ntez',pesanteztwof,2017-01-11 12:18:21,1,2,b'Amigos de #Guayaquil les invito a seguir la entrevista en @RadioHuancavilk con Lenin Artieda https://t.co/MvEEQbeFtz'
819685308874768384,b'Washington Pes\xc3\xa1ntez',pesanteztwof,2017-01-12 23:19:41,1,1,"b'""Ra\xc3\xbal Vayas lucha por la por la aprobaci\xc3\xb3n a favor de los campesinos"" #JustoLoQueNecesitamos\xe2\x80\xa6 https://t.co/hNybU7X1nn'"
819671826917969920,b'Washington Pes\xc3\xa1ntez',pesanteztwof,2017-01-12 22:26:06,0,1,b'Seguimos dialogando con periodistas de #ElOro esta vez en @Radio_Jubones  Ratific\xc3\xb3 que la #LeyDeComunicacion debe s\xe2\x80\xa6 https://t.co/iap0B6HwdK'
819631502145257474,b'Washington Pes\xc3\xa1ntez',pesanteztwof,2017-01-12 19:45:52,0,1,b'Hablando de la importancia del puerto de #Machala s\xc3\xad debe estar consesionado pero debe generar trabajo y recursos a\xe2\x80\xa6 https://t.co/dux3HrPLux'
819597000165523456,b'Washington Pes\xc3\xa1ntez',pesanteztwof,2017-01-12 17:28:46,0,2,"b'Atento escucho las necesidades de la gente, que no ha sido representada ni entendida, por los de antes, ni los de a\xe2\x80\xa6 https://t.co/jBMg2Gad16'"
819584885908209665,b'Washington Pes\xc3\xa1ntez',pesanteztwof,2017-01-12 16:40:38,1,0,b'Juntos crearemos un mejor Ecuador porque sabemos lo que el pa\xc3\xads necesita. #TerceraV\xc3\xada #Uni\xc3\xb3nEcuatoriana\xe2\x80\xa6 https://t.co/2IiMiN0mXr'
819560346436464640,b'Washington Pes\xc3\xa1ntez',pesanteztwof,2017-01-12 15:03:07,5,6,"b'Seguimos con la visita a #ElOro, gracias por la invitaci\xc3\xb3n masiva de los medios de comunicaci\xc3\xb3n, aqu\xc3\xad mi agenda.\xe2\x80\xa6 https://t.co/93JHTn3RXY'"
819545537657585665,b'Washington Pes\xc3\xa1ntez',pesanteztwof,2017-01-12 14:04:17,1,2,b'Ahora en diario El Correo conversando con sus periodistas sobre la propuesta de #Uni\xc3\xb3nEcuatoriana ! Gracias por el\xe2\x80\xa6 https://t.co/sHDYbxUOPX'
819535779923890178,b'Washington Pes\xc3\xa1ntez',pesanteztwof,2017-01-12 13:25:30,0,2,"b'Ahora, entrevista en @radiofiesta1060 en #Machala para proponerle a su audiencia, cambios verdaderos con gente nuev\xe2\x80\xa6 https://t.co/GU6iqS6SSb'"
819527326325149696,b'Washington Pes\xc3\xa1ntez',pesanteztwof,2017-01-12 12:51:55,5,3,"b'La corrupci\xc3\xb3n se roba el dinero de los ecuatorianos, casos como #Odebrecht y #Petroecuador deben investigarse con u\xe2\x80\xa6 https://t.co/VAdQp1sxea'"
819526166759534592,b'Washington Pes\xc3\xa1ntez',pesanteztwof,2017-01-12 12:47:18,4,4,"b'En @RadioCandela907 en entrevista en #Machala, gracias por abrir sus micr\xc3\xb3fonos a mi propuesta ! https://t.co/iG4JUoRnUP'"
819514875428962305,b'Washington Pes\xc3\xa1ntez',pesanteztwof,2017-01-12 12:02:26,0,2,"b'Tenemos que atraer la inversi\xc3\xb3n extranjera, vamos a darle seguridad con estabilidad y menos impuestos, sin persecuci\xc3\xb3n!! @radio_gaviota'"
819513810453229568,b'Washington Pes\xc3\xa1ntez',pesanteztwof,2017-01-12 11:58:12,1,2,"b'Llevo 35 a\xc3\xb1os sirviendo a mi pa\xc3\xads como maestro unidocente, profesor secundario, jurista, juez, fiscal provincial y general @radio_gaviota'"
819512068143480832,b'Washington Pes\xc3\xa1ntez',pesanteztwof,2017-01-12 11:51:17,4,6,"b'Quiero servir a mi pa\xc3\xads, quiero darle una nueva opci\xc3\xb3n, alejada de los extremos de izquierda o la derecha, ni los A\xe2\x80\xa6 https://t.co/C3wYpYYcOr'"
819511170247888896,b'Washington Pes\xc3\xa1ntez',pesanteztwof,2017-01-12 11:47:43,0,0,"b'Combatir\xc3\xa9 la corrupci\xc3\xb3n porque s\xc3\xa9 c\xc3\xb3mo hacerlo, en mis funciones de #fiscal ya la demostr\xc3\xa9, es una labor ardua pero posible ! @radio_gaviota'"
819509221289054208,b'Washington Pes\xc3\xa1ntez',pesanteztwof,2017-01-12 11:39:58,2,0,b'Buen d\xc3\xada! Arrancamos este jueves en @radio_gaviota de #Machala hablando de nuestra propuesta que busca un nuevo fut\xe2\x80\xa6 https://t.co/knnUO0rdqq'
819358052616929280,b'Washington Pes\xc3\xa1ntez',pesanteztwof,2017-01-12 01:39:17,5,6,b'Gracias por el c\xc3\xa1lido recibimiento en la gran provincia de #ElOro Arribamos hace pocos minutos al aeropuerto de San\xe2\x80\xa6 https://t.co/vi4oOh95LO'
820049310205300736,b'Washington Pes\xc3\xa1ntez',pesanteztwof,2017-01-13 23:26:05,0,0,"b'""Vota por Ra\xc3\xbal Vayas para una justa agricultura"" #VayasAsamble\xc3\xadstaNacional #Pes\xc3\xa1ntezPresidente #Listas19\xe2\x80\xa6 https://t.co/ECQ0mL2uF9'"
820040798704201729,b'Washington Pes\xc3\xa1ntez',pesanteztwof,2017-01-13 22:52:16,2,1,b'En entrevista con @AndresCarrion2 hablamos de la #corrupci\xc3\xb3n como ra\xc3\xadz de todos los problemas de #Ecuador ! Vamos a\xe2\x80\xa6 https://t.co/pYq1ynvScS'
819998544887214080,b'Washington Pes\xc3\xa1ntez',pesanteztwof,2017-01-13 20:04:22,0,2,"b'En este momento nos encontramos en el mercado de la ofelia, dialogando con los comerciantes y periodistas https://t.co/HkirQotWdE'"
819990734304583685,b'Washington Pes\xc3\xa1ntez',pesanteztwof,2017-01-13 19:33:20,0,1,b'Vamos hacia La Ofelia en #Quito con nuestra gente de #Uni\xc3\xb3n Ecuatoriana https://t.co/0zUs9F7TfE'
819952294766776320,b'Washington Pes\xc3\xa1ntez',pesanteztwof,2017-01-13 17:00:35,4,1,"b'La industria farmac\xc3\xa9utica nacional debe fortalecerse para tener producci\xc3\xb3n propia y competitiva, as\xc3\xad como investiga\xe2\x80\xa6 https://t.co/b04lpm1DBF'"
819951587779035136,b'Washington Pes\xc3\xa1ntez',pesanteztwof,2017-01-13 16:57:47,1,2,"b'Reuni\xc3\xb3n con Mar\xc3\xada del Carmen S\xc3\xa1enz, Directora Ejecutiva y  representante de la Industria Farmac\xc3\xa9utica de Investigac\xe2\x80\xa6 https://t.co/zXPN9dkQi1'"
